title,subtitle,date,issuer,plain_text,html_source,url
Province Ramps Up Production of Ontario-Made Ventilators,"Lifesaving Equipment Will Support Frontline Health Care, Prepare Province for Future Challenges","September 15, 2020",Office of the Premier,"GUELPH ― The Ontario government is investing $2.5 million through the Ontario Together Fund in Guelph-based Linamar Corp. to support the retooling of its assembly line to manufacture ventilator components to produce 10,000 Ontario-made e700 ventilators. O-Two Medical Technologies partnered with Linamar Corp. and other partners, including Bombardier, to produce these lifesaving devices to enhance future preparedness and help patients with severe cases of COVID-19 and other respiratory illnesses.
The announcement was made today by Premier Doug Ford and Vic Fedeli, Minister of Economic Development, Job Creation and Trade.
""Ontario is the workshop of Canada, and it's the creativity and ingenuity of enterprising companies like Linamar and O-Two that will make Ontario-made medical equipment known for quality and excellence across the country and around the world,"" said Premier Ford. ""By building homegrown capacity to make ventilators, we will never again have to rely on any other country for this critical piece of lifesaving medical equipment.""
Through the Ontario Together Fund, the government is delivering targeted investments that will increase the province's stockpile of Ontario-made products and personal protective equipment (PPE). This new manufacturing capacity will enable the province to combat the current COVID-19 outbreak and prepare for potential challenges in the future, while supporting local businesses during the safe and gradual reopening of the province.
""Businesses like Linamar, O-Two Medical, and Bombardier have stepped up with solutions to help at a critical time,"" said Minister Fedeli. ""Ontario's economic recovery would not be possible without the collective efforts of everyone in every corner of this province. We applaud our world-class manufacturing sector for helping ensure the province has the Ontario-made solutions to respond to the needs now and any future emergency, should it arise.""
Linamar is a leading Ontario-based diversified advanced manufacturing company supplying the automotive, agriculture, and aerial work platform markets.
Quick Facts
The government launched the $50 million Ontario Together Fund to help businesses retool their operations to produce PPE and develop technology-driven solutions and services for businesses to reopen safely.
Businesses and individuals looking to help in the fight against COVID-19 can submit their proposals through the Ontario Together web portal.
The Workplace PPE Supplier Directory provides businesses with information on personal protective equipment (PPE) suppliers.
Quotes
""Linamar was proud to be part of the efforts to help supply Ontario’s frontline healthcare workers with needed equipment to save lives in our province. Our work on various ventilator projects gave our teams something very positive to focus on in a time frame when there weren’t many positive stories! I am very proud of our team and their rapid response in a matter of weeks to provide parts critical to the needs of our province.""
- Linda Hasenfratz
Chief Executive Officer, Linamar
""O-Two Medical Technologies was eager to be part of the fight against COVID-19, which is why we partnered with Linamar and Bombardier to produce these essential ventilators. Our e700 ventilator has a proven track record and, together with the provincial government, we will continue to deliver this critical, life-saving equipment to the people of Ontario so that we are ready both now and in the future.""
- Kim Lassaline
Chief Executive Officer, O-Two Medical Technologies
""We are proud to be assembling various components/sub-assemblies for these life-saving O-Two ventilators. This project has allowed us to recall almost 50 employees and keep these highly skilled workers employed during the hardest part of the pandemic. Having and maintaining our strong manufacturing presence in Ontario is critical, especially during these unpredictable times when Made-in-Ontario solutions matter now more than ever.""
- Lindsay Fenton
General Manager, Thunder Bay site, Bombardier Transportation
Additional Resources
Learn more about Stage 3 of reopening Ontario
See how your organization can help fight COVID-19
Information and advice to help your business navigate the economy during COVID-19
Visit Ontario’s website to learn more about how the province continues to protect Ontarians from COVID-19
Related Topics
Government
Learn about the government services available to you and how government works. Learn more
Health and Wellness
Get help navigating Ontario’s health care system and connecting with the programs or services you’re looking for. Learn more","<span id=""share_mob""><a id=""share_mob_list"" name=""share""></a><h3 class=""tocSmall release_title_mobile"">Share</h3><a target=""_blank"" href=""http://twitter.com/intent/tweet?url=https://news.ontario.ca/en/release/58380/province-ramps-up-production-of-ontario-made-ventilators&amp;text=Province Ramps Up Production of Ontario-Made Ventilators""><img src=""https://styles.news.ontario.ca/assets/twitter.png"" alt=""Twitter icon"" class=""mr-3""></a><a target=""_blank"" href=""https://www.facebook.com/sharer/sharer.php?u=https://news.ontario.ca/en/release/58380/province-ramps-up-production-of-ontario-made-ventilators&amp;title=Province Ramps Up Production of Ontario-Made Ventilators""><img src=""https://styles.news.ontario.ca/assets/facebook.png"" alt=""Facebook icon"" class=""mr-3""></a><a href=""mailto:?subject=Province Ramps Up Production of Ontario-Made Ventilators&amp;body=https://news.ontario.ca/en/release/58380/province-ramps-up-production-of-ontario-made-ventilators""><img src=""https://styles.news.ontario.ca/assets/email.png"" alt=""Email icon"" class=""mr-3""></a><a href=""#""><img src=""https://styles.news.ontario.ca/assets/print.png"" alt=""Print icon"" class=""mr-3""></a><hr class=""bold_hr""></span><div id=""toc""><h3 class=""release_title_mobile"">Table of Contents</h3><ol id=""table_cols"" class=""pl_13 mb-0 ml-2""><li><a href=""#content"">Content</a></li><li><a href=""#quickfacts"">Quick Facts</a></li><li><a href=""#quotes"">Quotes</a></li><li><a href=""#resources"">Additional Resources</a></li><!----><li><a href=""#topics"">Related Topics</a></li><!----><!----></ol><hr class=""bold_hr""></div><a id=""content"" name=""content""></a><h3 class=""d-none tocLarge tocSmall release_title_mobile"">Content</h3><div><p>GUELPH ― The Ontario government is investing $2.5 million through the Ontario Together Fund in Guelph-based Linamar Corp. to support the retooling of its assembly line to manufacture ventilator components to produce 10,000 Ontario-made e700 ventilators. O-Two Medical Technologies partnered with Linamar Corp. and other partners, including Bombardier, to produce these lifesaving devices to enhance future preparedness and help patients with severe cases of COVID-19 and other respiratory illnesses.</p>
<p></p>
</div><div><p>The announcement was made today by Premier Doug Ford and Vic Fedeli, Minister of Economic Development, Job Creation and Trade.</p>
<p>""Ontario is the workshop of Canada, and it's the creativity and ingenuity of enterprising companies like Linamar and O-Two that will make Ontario-made medical equipment known for quality and excellence across the country and around the world,"" said Premier Ford. ""By building homegrown capacity to make ventilators, we will never again have to rely on any other country for this critical piece of lifesaving medical equipment.""</p>
<p>Through the Ontario Together Fund, the government is delivering targeted investments that will increase the province's stockpile of Ontario-made products and personal protective equipment (PPE). This new manufacturing capacity will enable the province to combat the current COVID-19 outbreak and prepare for potential challenges in the future, while supporting local businesses during the safe and gradual reopening of the province.</p>
<p>""Businesses like Linamar, O-Two Medical, and Bombardier have stepped up with solutions to help at a critical time,"" said Minister Fedeli. ""Ontario's economic recovery would not be possible without the collective efforts of everyone in every corner of this province. We applaud our world-class manufacturing sector for helping ensure the province has the Ontario-made solutions to respond to the needs now and any future emergency, should it arise.""</p>
<p>Linamar is a leading Ontario-based diversified advanced manufacturing company supplying the automotive, agriculture, and aerial work platform markets.</p>
</div><hr class=""bold_hr""><div><a id=""quickfacts"" name=""quickfacts""></a><h3 class=""tocLarge release_title_mobile"">Quick Facts</h3><ul class=""pl_13""><li class=""mb-1""><span>The government launched the $50 million Ontario Together Fund to help businesses retool their operations to produce PPE and develop technology-driven solutions and services for businesses to reopen safely.
</span></li><li class=""mb-1""><span>Businesses and individuals looking to help in the fight against COVID-19 can submit their proposals through the <a href=""https://www.ontario.ca/page/how-your-organization-can-help-fight-coronavirus"">Ontario Together web portal</a>.</span></li><li class=""mb-1""><span>The <a href=""https://covid-19.ontario.ca/how-your-organization-can-help-fight-coronavirus/#find-ppe"">Workplace PPE Supplier Directory</a> provides businesses with information on personal protective equipment (PPE) suppliers.</span></li></ul><hr class=""bold_hr""></div><div><a id=""quotes"" name=""quotes""></a><h3 class=""tocLarge release_title_mobile"">Quotes</h3><blockquote class=""quote_sidebar""><p>""Linamar was proud to be part of the efforts to help supply Ontario’s frontline healthcare workers with needed equipment to save lives in our province. Our work on various ventilator projects gave our teams something very positive to focus on in a time frame when there weren’t many positive stories! I am very proud of our team and their rapid response in a matter of weeks to provide parts critical to the needs of our province.""</p><p class=""text-right pr-3""><strong>- Linda Hasenfratz <br>Chief Executive Officer, Linamar</strong></p></blockquote><blockquote class=""quote_sidebar""><p>""O-Two Medical Technologies was eager to be part of the fight against COVID-19, which is why we partnered with Linamar and Bombardier to produce these essential ventilators. Our e700 ventilator has a proven track record and, together with the provincial government, we will continue to deliver this critical, life-saving equipment to the people of Ontario so that we are ready both now and in the future.""</p><p class=""text-right pr-3""><strong>- Kim Lassaline <br>Chief Executive Officer, O-Two Medical Technologies</strong></p></blockquote><blockquote class=""quote_sidebar""><p>""We are proud to be assembling various components/sub-assemblies for these life-saving O-Two ventilators. This project has allowed us to recall almost 50 employees and keep these highly skilled workers employed during the hardest part of the pandemic. Having and maintaining our strong manufacturing presence in Ontario is critical, especially during these unpredictable times when Made-in-Ontario solutions matter now more than ever.""</p><p class=""text-right pr-3""><strong>- Lindsay Fenton <br>General Manager, Thunder Bay site, Bombardier Transportation</strong></p></blockquote><hr class=""bold_hr quote_hr_additional""></div><div><a id=""resources"" name=""resources""></a><h3 class=""tocLarge tocSmall release_title_mobile"">Additional Resources</h3><ul class=""pl_13""><li class=""mb-1""><a href=""https://www.ontario.ca/page/reopening-ontario-stages?_ga=2.86498072.1618983535.1596055667-1071918938.1544728626#section-3"" class=""a_no_line"">Learn more about Stage 3 of reopening Ontario</a></li><li class=""mb-1""><a href=""https://www.ontario.ca/page/how-your-organization-can-help-fight-coronavirus"" class=""a_no_line"">See how your organization can help fight COVID-19</a></li><li class=""mb-1""><a href=""https://www.ontario.ca/page/covid-19-support-businesses?_ga=2.177788133.1153314071.1591639287-1071918938.1544728626"" class=""a_no_line"">Information and advice to help your business navigate the economy during COVID-19</a></li><li class=""mb-1""><a href=""https://www.ontario.ca/page/how-ontario-is-responding-covid-19"" class=""a_no_line"">Visit Ontario’s website to learn more about how the province continues to protect Ontarians from COVID-19</a></li></ul><hr class=""bold_hr""></div><!----><div><a id=""topics"" name=""topics""></a><h3 class=""release_title_mobile"">Related Topics</h3><div class=""mb-4""><p class=""h5 mb-0"">Government</p><p>Learn about the government services available to you and how government works. <a href=""https://www.ontario.ca/page/government"">Learn more</a></p></div><div class=""mb-4""><p class=""h5 mb-0"">Health and Wellness</p><p>Get help navigating Ontario’s health care system and connecting with the programs or services you’re looking for. <a href=""https://www.ontario.ca/page/health-care-ontario"">Learn more</a></p></div><hr class=""bold_hr""></div>",https://news.ontario.ca/en/release/58380/province-ramps-up-production-of-ontario-made-ventilators
